{
  "$schema": "https://json-schema.org/draft/2020-12/schema",
  "$id": "https://junjo.ai/contracts/telemetry/telemetry-fixture.v3.schema.json",
  "title": "Junjo normalized telemetry fixture",
  "type": "object",
  "additionalProperties": false,
  "required": ["contract_version", "scenario", "trace_id", "service_name", "spans"],
  "properties": {
    "contract_version": {"const": 3},
    "scenario": {"type": "string", "minLength": 1},
    "trace_id": {"type": "string", "pattern": "^[0-9a-f]{32}$"},
    "service_name": {"type": "string", "minLength": 1},
    "spans": {
      "type": "array",
      "minItems": 1,
      "items": {"$ref": "#/$defs/span"}
    }
  },
  "$defs": {
    "event": {
      "type": "object",
      "additionalProperties": false,
      "required": ["name", "timeUnixNano", "attributes", "droppedAttributesCount"],
      "properties": {
        "name": {"type": "string", "minLength": 1},
        "timeUnixNano": {"type": "string", "pattern": "^(?:0|[1-9][0-9]{0,19})$"},
        "attributes": {"type": "object"},
        "droppedAttributesCount": {"type": "integer", "minimum": 0}
      }
    },
    "span": {
      "type": "object",
      "additionalProperties": false,
      "required": [
        "trace_id",
        "span_id",
        "parent_span_id",
        "service_name",
        "resource_attributes_json",
        "resource_dropped_attributes_count",
        "name",
        "kind",
        "start_time",
        "end_time",
        "status_code",
        "status_message",
        "attributes_json",
        "events_json",
        "links_json",
        "trace_flags",
        "trace_state",
        "dropped_attributes_count",
        "dropped_events_count",
        "dropped_links_count"
      ],
      "properties": {
        "trace_id": {"type": "string", "pattern": "^[0-9a-f]{32}$"},
        "span_id": {"type": "string", "pattern": "^[0-9a-f]{16}$"},
        "parent_span_id": {
          "oneOf": [
            {"type": "string", "pattern": "^[0-9a-f]{16}$"},
            {"type": "null"}
          ]
        },
        "service_name": {"type": "string", "minLength": 1},
        "resource_attributes_json": {"type": "object"},
        "resource_dropped_attributes_count": {"type": "integer", "minimum": 0},
        "name": {"type": "string", "minLength": 1},
        "kind": {"enum": ["INTERNAL", "SERVER", "CLIENT", "PRODUCER", "CONSUMER"]},
        "start_time": {"type": "string", "format": "date-time"},
        "end_time": {"type": "string", "format": "date-time"},
        "status_code": {"type": "string"},
        "status_message": {"type": "string"},
        "attributes_json": {
          "type": "object",
          "properties": {
            "junjo.parent_executable_type": {
              "enum": ["workflow", "subflow", "node", "run_concurrent", "agent"]
            },
            "junjo.parent_executable_definition_id": {"type": "string", "minLength": 1},
            "junjo.parent_executable_runtime_id": {"type": "string", "minLength": 1},
            "junjo.parent_executable_structural_id": {"type": "string", "minLength": 1},
            "junjo.correlation.type": {"type": "string", "minLength": 1},
            "junjo.correlation.id": {"type": "string", "minLength": 1}
          }
        },
        "events_json": {
          "type": "array",
          "items": {"$ref": "#/$defs/event"}
        },
        "links_json": {"type": "array", "items": {"type": "object"}},
        "trace_flags": {"type": "integer", "minimum": 0},
        "trace_state": {"type": ["string", "null"]},
        "dropped_attributes_count": {"type": "integer", "minimum": 0},
        "dropped_events_count": {"type": "integer", "minimum": 0},
        "dropped_links_count": {"type": "integer", "minimum": 0}
      }
    }
  }
}
